{
  "analysis_contract": {
    "accounting": "F=fresh input; R=gross-fresh cache-read; C_w=F+wR",
    "cache_read_weights": [
      0,
      0.1,
      1
    ],
    "claim_scope": "this 16-turn horizon, frozen schedule, accounting, model, and runtime only",
    "curve_fits": "linear and quadratic descriptive fits over observed positions 1..16 only",
    "forbidden_interpretations": [
      "no structural or asymptotic complexity claim",
      "no extrapolation beyond position 16",
      "no K-ARC performance-superiority claim"
    ],
    "horizons": [
      4,
      8,
      12,
      16
    ],
    "primary_outputs": [
      "arm-by-position mean F, R, and gross for positions 1..16",
      "paired-session cumulative C_w difference and ratio at H=4,8,12,16",
      "first observed per-turn and cumulative gross crossover, if any"
    ],
    "quality": "report exact-answer correctness by arm and horizon; withhold a cost-optimal recommendation if quality differs materially",
    "uncertainty": "paired-session percentile bootstrap, 10000 resamples, two-sided 95% CI"
  },
  "approval_gate": {
    "execution_source_freeze": "must be created after approval and before the first probe/model turn; it may implement but may not alter this scientific contract",
    "required_user_approvals": [
      "384 planned valid model turns and 480 model-spend attempt cap",
      "experiment-only K-ARC MCP search/get in karc-full; zero in rag-bm25",
      "separately capped runtime/model availability probe",
      "the planning token range and unavailable exact dollar amount"
    ],
    "scientific_contract_edits_after_approval": "FORBIDDEN; amendment required"
  },
  "attempt_contract": {
    "infra_failure_attempt_cap": 96,
    "infra_failure_definition": "failed call with zero normalized model usage",
    "infra_failures_are_append_only_and_do_not_refund_total_api_call_cap": true,
    "max_model_spend_attempts_per_turn": 3,
    "model_spend_attempt_cap": 480,
    "model_spend_definition": "successful turn or any failed call with non-zero normalized model usage",
    "planned_valid_turns": 384,
    "provider_probe": "not part of decision-bearing raw; requires separate explicit approval and cap",
    "total_api_call_cap": 576
  },
  "authority": [
    "user-directed E10 planning discussion (approval still pending for execution)",
    "docs/analysis/e5-g1-cache-asymmetry-canary--codex-workorder.md",
    "docs/analysis/e9-writeup-and-release--codex-workorder.md §0/§1/Lane P2"
  ],
  "cost_plan": {
    "H16_descriptive_fit_fresh_tokens": 13302163,
    "H16_output_tokens_linear_turn_count_scenario": 117656,
    "H16_planning_gross_tokens": {
      "descriptive_fit_scenario": 94663136,
      "flat_at_position_8_scenario": 64598324,
      "not_a_confidence_interval": true
    },
    "dollar_formula_per_million_tokens": "13.302163*p_fresh + 81.360973*p_cache_read + 0.117656*p_output; subscription/runtime may not expose dollar cost",
    "observed_E5_G1": {
      "cache_read_tokens": 18917632,
      "dollar_cost": null,
      "fresh_input_tokens": 4047596,
      "gross_input_tokens": 22965228,
      "output_tokens": 58828,
      "valid_turns": 192
    },
    "source": "E5-G1 observed positions 1..8; planning scenarios only"
  },
  "design": {
    "arms": [
      "karc-full",
      "rag-bm25"
    ],
    "budget_pct": 5,
    "granularity": "whole-document E5-G1",
    "new_experiment_not_a_reinterpretation_of_E5_G1": true,
    "objective": "measure whether the E5-G1 turn-position level-versus-growth pattern persists through position 16",
    "paired_sessions": 12,
    "planned_valid_turns": 384,
    "reuse_count": 90,
    "reuse_definition": "fraction of non-initial session tasks whose gold artifact was gold for an earlier task in the same session",
    "reuse_denominator": 180,
    "reuse_factor": 0.5,
    "same_task_schedule_for_both_arms": true,
    "schedule_seed": 10160,
    "session_length": 16
  },
  "embedding_calls_at_freeze": 0,
  "experiment": "E10-P2-H16",
  "fixture": {
    "budget_tokens": 1756,
    "corpus_content_hash": "4378159b89fe3128e031e4398c96495cd661ff2c91cfc6e457827b250fb9228a",
    "corpus_seed": 4000,
    "root": "fixture/e4-v2",
    "source_manifest_sha256": "d8ec0bcf8354a5dc1046c7787b9ce4550086148ecfb4e42c1791bbc4b81ccc43"
  },
  "model_calls_at_freeze": 0,
  "preparation_base_git_hash": "93012f30730ea95ed9dd777b9cb9dbe09b665f18",
  "preparation_source_sha256": {
    "scripts/prepare_e10_p2_h16.py": "56998e8da1df6e626c54c99b286642e6f839ad135c03c3fe9e2cc2845c94da83",
    "src/karc/bench/e10_horizon_canary.py": "51d4a6b9d7f641147f891d77f1caf5f6683ced6bb57198a2c022a307617f6687",
    "src/karc/bench/e5_cache_canary.py": "af8cbce3af5b91245102f30eefa5f140133885387a0a6cd81fa594614645f580",
    "src/karc/bench/e5_killgate.py": "701d0265eb6431ee84eb24c40e8f8fec29ef61810811e92fb1c5168588d10e32"
  },
  "privacy_contract": {
    "forbid": [
      "argv",
      "command",
      "credential",
      "cwd",
      "environment",
      "output",
      "output_text",
      "prompt",
      "tool_response",
      "transcript"
    ],
    "original_fixture_content_is_not_copied_to_experiment_raw": true,
    "persist": [
      "normalized token usage",
      "grade",
      "IDs",
      "counts",
      "hashes",
      "failure category and hashed error digest"
    ],
    "raw_is_append_only": true
  },
  "runtime_pin": {
    "auth_mode": "ChatGPT subscription",
    "codex_cli": "codex-cli 0.144.5",
    "mismatch_disposition": "STOP_WITHOUT_SUBSTITUTION",
    "model": "gpt-5.6-luna",
    "provider_model_availability": "UNKNOWN_WITHOUT_APPROVED_PROBE",
    "reasoning_effort": "high",
    "substitution": "FORBIDDEN"
  },
  "schedule_sha256": "e9ee352fdaa8b8f3942cf77398b3c6b453952535a89e022d8b53aa08405f7006",
  "schema": "e10-p2-h16-pre-execution-v1",
  "sha256": "75dd169f2d3eb05f7a40717ebd1199e10c3a8b22f918aaf7d53a280f966d44a2",
  "status": "AWAITING_USER_APPROVAL",
  "stopping_contract": {
    "before_first_turn": [
      "stop if Codex CLI is not exactly 0.144.5",
      "stop if gpt-5.6-luna/high cannot be selected; do not substitute",
      "stop if fixture, schedule, schema, or execution-source hash mismatches",
      "stop until the user explicitly approves model calls and experiment-only K-ARC MCP"
    ],
    "during_run": [
      "stop globally on reported-model mismatch",
      "stop globally on missing or internally inconsistent token telemetry",
      "stop globally on context overflow or runtime truncation; do not shorten prompts",
      "stop globally if rag-bm25 records any K-ARC MCP search/get call",
      "stop when any registered attempt cap is reached"
    ],
    "task_errors": "grade and retain normalized metadata; task-answer error alone is not a stop"
  }
}
